Problem Solving, Operations, Strategy,Problem Solving & Strategy
Recruiting, Operations, Employer Engagement,Human Resources & Training
Data Engineering, Cloud Architecture, Data Analysis,Data & Analytics
Instructional Skills, Coaching, Training,
Financials, Data Analysis, Brand Marketing,Financial Management
Software Development, Automation Testing, Testing,
Brand Strategy, Presentation, Retail,Marketing & Branding
Emergency Management, Crisis Management, Disaster Management,Emergency & Disaster Management
Research Methods, Policy Development, Science Diplomacy,Research & Development
Accountancy, Taxation, International Taxation,Financial Management
Information Security, Project Management, Supply Chain Assurance,
Communication Skills, Financial Analytics, Presentation Skills,Interpersonal & Communication Skills
Interpret Data, Project Management, Networking,
Business Analysis, Data Analysis, Strategic Analysis,Business Analysis & Consulting
Project Management, Relationship Building, Sales,Project & Program Management
Stock Management, People Management,,
Selling Technology, Negotiation,,
Construction Delivery, Project Planning, Design Review,
Requirements Gathering, Project Management, Data Analysis,
Data Analysis,,,Data & Analytics
Cyber Threat Intelligence, Project Management, Cyber Security,Cybersecurity & Information Security
Operational Management, Training Delivery, Logistics,
Data Science, Mathematical Analysis, Market Analysis,Data Science & Artificial Intelligence
Various Police Qualifications, Taser, Driving,
Technology, People Management, Risk Management,
Planning and Delivery, Research and Analysis, Report Writing,
Procurement Strategy, Government Liaison, Marketing Strategy,Supply Chain & Procurement
Data Analysis, Content Management, Stakeholder Management,Data & Analytics
Data analysis, data engineering, programming ,
Comms, Family Office Management, Project Management,
Operational Resilience, Data Protection, Cybersecurity,
Brand Strategy, Business Development, Innovation Strategy,Marketing & Branding
Entrepreneurship,,,Creative Solutions & Innovation
Project Management, Policy, Market Research,Project & Program Management
Cybersecurity, Digital Forensics, Incident Response,Technology & Networking
Leadership, Development, Communication,Leadership & Development
Trend Analysis, Data Analysis,,
Planning, Data Analysis, Communication,
Data Analysis, Strategy, Geopolitical Analysis,Data & Analytics
Compassion, Care, Clinical Skills,
Project Management, Client Development, Bid Writing,Project & Program Management
Business Analysis, Management Consulting, Cyber Security,Business Analysis & Consulting
Project Management, Stakeholder Management, Data Analysis,Project & Program Management
Commercial Property Asset Management, Property Law,,Real Estate & Property Management
Commercial Property, Sales, Acquisitions,Real Estate & Property Management
Sales, Data Analysis, Sales Strategy,Retail & Sales
Brand Marketing, Communications Planning, Digital Marketing,Marketing & Branding
Architecture, Project Management, Managing Director,Photography & Design
Lesson Planning, Care of Trainee, Learner Assessment,Education & Training
Investment Management, Mergers & Acquisitions, Company Strategy,Investment Management & Financial Structuring
Data Analysis, Financial Markets, Relationship Management,Data & Analytics
Mathematics, Programming, Business Development,
Project Management, Financial Planning, Compliance,Project & Program Management
Stakeholder Engagement, Change Management, Data Analysis,
Risk Management, Project Management, Relationship Management,
Data Analysis, Programme Management, International Expansion,Data & Analytics
Natural Science, Research, Strategic Planning,
Creative Solutions, Brand Strategy, Media Strategy,Creative Solutions & Innovation
Data Analysis, Strategy, Negotiation,Data & Analytics
Bid Management, Project Management, Data Analytics,
Education, Product Management, Marketing Lead,
Project Management, Statistical Analysis,,Project & Program Management
Law, Firearms Tactics, First Aid,Law & Legal
Risk Management, Project Planning, Client Management,
Investment Analysis, ESG Analysis, Financial Modelling,
Real Estate, Negotiation, Financial Modelling,
Company Director, Account Management, Project Management,
Construction Project Management, Design, Planning,
Data Analysis, Programming, User-Facing Design,Data & Analytics
Financial Analysis, Client Communication, Time Management,Financial Analysis & Trading
Open Source Intelligence, Forensic Accounting, Litigation Support,
Interpersonal Skills, Networking, Financial Planning,Interpersonal & Communication Skills
Content Creation, Operations, Sales,
Sales, Business Development, Relationship Management,Retail & Sales
Research, Written Communication, Problem Solving,Analysis & Research
Health and Safety, Safety Investigations, Data Analysis,Health & Safety
Human Resources, Workforce Management, Financial Management,
Town and Country Planning, Project Management,,
Sales Acumen, Public Speaking, Forecasting,
Finance,,,
Archaeology, Heritage, Lecturing,
Accounting, Controls, Data Analysis,
Project Management, IT Tools, Data Analysis,Project & Program Management
Photographic and Film Shoot Production, Budget Management,,Photography & Design
Engagement Preparation, Project Coordination, Speech Writing,
Curriculum Writing, Instruction, Data Analysis,
Problem Solving, Project Management, Leadership,Problem Solving & Strategy
Critical Thinking, Investigation, Data Analysis,Problem Solving & Strategy
Sales, Technology, Communication,Retail & Sales
Investigation, Interviews, Public Liaison,
Data Analysis, Computing, Project Management,Data & Analytics
Policy Development, Strategy Development, Business Development,Research & Development
Telecommunications, Project Management, Networking,
Financial Understanding, Maths,,
Technology Scout, Project Management, Research,
Data, Salesforce Admin, Salesforce Consultant Cert,
Data Analysis, Python, SQL,Data & Analytics
Analysis, Judgement, Economics,Analysis & Research
Prisoner Management, Officer Duties, Deescalation Techniques,
Cloud, Business Development, Stakeholder Management,
Conducting, Music Education, Orchestration,Music & Arts
Report Writing, Data Analysis, Project Management,
Data Analysis, Presentation, Communication,Data & Analytics
Software Testing, Team Leadership, Project Management,
Client Services, Sales, Interpersonal Skills,
Data Analysis, Marketing Strategy, Regulatory Compliance,Data & Analytics
Management, HR, Policy,
Commercial Strategy, Management Consulting, Data Analysis,
Data Management, Geopolitical Analysis, Negotiation,MS Excel & Data Management
Customer Experience Management, Strategic Thinking, Data Analysis,
People Management, Operational Skills, Accounting,
Finance, Data Analysis, Trading,
Engineering, Electronics, Project Management,
KPI Management, Service Delivery Management, Client Management,
Communication, Business Development, Social Media Engagement,
Data Analysis, Financial Management,,Data & Analytics
Data Analytics and Document Processing,,,
Programme Management, Technology Strategy, Process Management,
Data Analysis, Project Management, Design,Data & Analytics
Project Management, People Management, Cost Management,Project & Program Management
Data Analysis, Excel, SQL,Data & Analytics
HR Management, Recruitment, Quality Assurance,
Project Management, Bid Management,,Project & Program Management
Sales, Account Management, Global Logistics,Retail & Sales
Forecasting, Project Management, Profit and Loss Analysis,
Financial Acumen, Leadership, Strategic Planning,
Project Management,,,Project & Program Management
Project Management, Code and Conduct Management, Data Analysis,Project & Program Management
Communication, SharePoint Online,,
Policy Design and Analysis, Public Affairs, Government,
Project Management, Logistics Management,,Project & Program Management
Data Analysis, Client Communication, Project Management,Data & Analytics
Software Modelling, Insurance, Data Analytics,
Microbiology, Chemical Handling, Instruction,
Data Analysis, Customer Service, IT Skills,Data & Analytics
Cost Management, Resource Management, Construction Management,
UK Tax Law,,,
Advanced Driver, Public Order Trained, Stinger,
Analysis, Data Visualisation,,Analysis & Research
Negotiation, Data Analysis, Strong Maths Knowledge,
Communication, Time Management,,
Asset Management, Financial Regulation, Leadership,
Programming, Cyber Security, Software Development,Programming & IT
Mechanical Engineering, Regulatory Analysis, Environmental Policy,Environmental Policy & Engineering
Policy Development, Stakeholder Engagement, Communication,Research & Development
Understanding Corporate Structures,,,
Management, Events Planning, Fitness,
Stakeholder Relation, Project Planning, Risk Management,
Editing, Social Media, Journalism,
Medical Skills, Mental Health Assessments,,
Emergency Services Training, Counter-Terrorism Awareness,,Public Safety & Emergency Services
Excel, Data Analysis, Risk Management,MS Excel & Data Management
Data Analysis, Risk Prevention Strategy, Cyber Security,Data & Analytics
Conflict Management,,,
Financial Forecasts, Data Analysis, Communication,
Logistics, Planning, Leadership,Operations & Logistics
Critical Thinking, Data Analysis, Communication,Problem Solving & Strategy
Political Risk Analysis, Geopolitics, OSINT,
Organization, Planning, Leadership,
Physical Security, Prehospital Care, IT Support,
Financial Market Trading, Cash Management, Investments,
Data Analysis, Behavioral Science, Strategic Communications,Data & Analytics
Data Analysis, Data Science, Project Management,Data & Analytics
Mental Health Assessments, Low Intensity CBT, Data Analysis,
Communication, Negotiating, Compliance,
Mountain Leader, Ski Instructor, Climbing Instructor,
Business Development, Account Management,,
Operational Planning, Threat Assessment, Intelligence Analysis,Operations & Logistics
Legal Analysis, Strategy, Interview Techniques,
Project Management, Secretariat Tasks, Event Coordination,Project & Program Management
Project Management, Senior Stakeholder Engagement, Brand Strategy,Project & Program Management
Policy Development, Communications, Governance,Research & Development
Public Law, Financial Regulation, Commercial Awareness,Public Policy & Governance
Negotiation, Diplomacy, Data Analysis,
Macroeconomic Trend Analysis, Risk Analysis, Report Writing,
Project/Programme Management,,,
Negotiation, Analysis, Presentations,
Iranian Knowledge, South African History Knowledge,,Languages & Cultural Knowledge
Requirements Analysis, Backlog Refinement, Stakeholder Management,
Defence Policy, Media/Press Engagement, Public Policy,
Communication, Teamwork, Problem Solving,
Career Defence Professional, Overseas Advisor,,
Video Production, Photography, Graphic Design,Media & Branding
Video Production, Photography, Graphic Design,Media & Branding
Financial Accounting, Budgeting, Research,
Former Optician, Management, Sales,
Relationship Building, Sales, Data Analytics,
Programme/Project Management, Risk and Cost Analysis,,
Security Risk Management, Threat Analysis, Cyber Consultancy,
Legal Analysis, Product Innovation,,
Leading and Motivating a Team, Logistics Planning, H&S,
Product Management, Artificial Intelligence, Sales,
Data Analysis, Client Protection,,Data & Analytics
MS Excel,,,MS Excel & Data Management
Gas Safe, OFTEC Oil Qualified,,Gas & Oil Industry
Policy Analysis, Stakeholder Engagement, Communication Skills,
Report Writing, Data Analysis, Stakeholder Management,
Stakeholder Engagement, Relationship Building, Policy Advice,
Data Analysis, Geospatial Analysis, Report Writing,Data & Analytics
Data Analysis, Strategy Development, Business Case Development,Data & Analytics
Head Hunting, Recruitment, Stakeholder Management,
Analytics, Mathematics, Coding,
Technology Strategy, Product Roadmapping, Requirements Capture,
Project Management, Electrical Engineering, Civil Engineering,Project & Program Management
Adobe Suite, AutoCAD,,Art & Design
Team Management, Recruitment, Training,
Management, Policy, Events Organization,
Operational Planning, Strategy Development, Digital Product Development,Operations & Logistics
Verbal Communication, Written Communication, Diary Management,
Data Analysis, Stakeholder Management, Reporting,Data & Analytics
Data Analysis, Project Management, Client Management,Data & Analytics
Law, Food Law, Regulations,Law & Legal
Research Skills, Analytical Thinking, Teaching Skills,
Sales, Marketing, Logistics,Retail & Sales
Analysis, Drafting, Advocacy,Analysis & Research
Operational Model and Strategy, Business Change, Training,
Contracts Management, People Management, Programme Management,
Financial Analysis,,,Financial Analysis & Trading
Driving,,,
Strategy Development, Planning, Project/Programme Delivery,
User Research, Design, Stakeholder Management,
3D Design, CAD, Presenting Ideas,
Firefighting, Calmness Under Pressure, De-escalation,
CCTV, AI, Security,
Policy Advice, Intelligence Analysis, Diplomacy,
Brand Marketing, Event Marketing, SEO,Marketing & Branding
Data Analysis, Sustainability, Product Management,Data & Analytics
Pharmacy, Clinical Experience, Communication,Pharmacy & Clinical
Legal, Litigation, Advisory,Legal & Advocacy
Risk Management, Trading, Market Analysis,
Data Management, Research,,MS Excel & Data Management
Software Engineering, Networking, Databases,Data Science & Project Management
Masters in Engineering, CFD Software Sales,,
Languages, Data Analysis/Coding, Operational Management,Languages & Cultural Knowledge
Data Science, Artificial Intelligence, Strategy,Data Science & Artificial Intelligence
SOP Implementation, Compliance Oversight, Quality Management,SOP & Quality Management
Business Modelling, Financial Analysis, Communication,Business Modelling & Innovation
Strategic Thinking, People Management, Communication,
Legal Research, Writing, Advocacy,
Project Management, Operations Management, Research,Project & Program Management
Tactical Communication, Endurance,,Tactical Communication & Endurance
Data Science, Project Management, Software Engineering,Data Science & Artificial Intelligence
Government Affairs, Public Affairs, Research,Government Affairs & Public Affairs
Sponsorship Sales, Photography, Media Branding,Sponsorship Sales & Photography
Investment Management, Sales, Financial Structuring,Investment Management & Financial Structuring
